<?xml version="1.0" encoding="UTF-8"?>
<!-- FAZER O DTD INTERNO -->
<!DOCTYPE imobiliaria [
<!ELEMENT imobiliaria (imovel+)>
<!ELEMENT imovel (descricao,proprietario,endereco,caracteristicas)>
<!ELEMENT descricao (#PCDATA)>
<!ELEMENT proprietario (nome,email,telefone)>
<!ELEMENT nome (#PCDATA)>
<!ELEMENT email (#PCDATA)>
<!ELEMENT telefone (#PCDATA)>
<!ELEMENT endereco (rua,bairro,cidade,numero)>
<!ELEMENT rua (#PCDATA)>
<!ELEMENT bairro (#PCDATA)>
<!ELEMENT cidade (#PCDATA)>
<!ELEMENT numero (#PCDATA)>
<!ELEMENT caracteristicas (tamanho,numQuartos,numBanheiros)>
<!ELEMENT tamanho (#PCDATA)>
<!ELEMENT numQuartos (#PCDATA)>
<!ELEMENT numBanheiros (#PCDATA)>
]>
<imobiliaria>
    <imovel>
        <descricao>
            "imovel pequeno para familias pequenas."
        </descricao>
        <proprietario>
            <nome>"Elyabe"</nome>
            <email>null</email>
            <telefone>null</telefone>

        </proprietario>
        <endereco>
            <rua>"Jasinto Dores Aquino Rego"</rua>
            <bairro>Cara do Gato</bairro>
            <cidade>Juremal</cidade>
            <numero>"69"</numero>
        </endereco>
        <caracteristicas>
            <tamanho>"55 metros quadrados."</tamanho>
            <numQuartos>"3"</numQuartos>
            <numBanheiros>"2"</numBanheiros>
        </caracteristicas>
    </imovel>
        <imovel>
            <descricao>Apartamento moderno em condomínio fechado.</descricao>
            <proprietario>
                <nome>Maria Silva</nome>
                <email>maria@email.com</email>
                <telefone>(11) 98765-4321</telefone>
            </proprietario>
            <endereco>
                <rua>Avenida Brasil</rua>
                <bairro>Centro</bairro>
                <cidade>São Paulo</cidade>
                <numero>123</numero>
            </endereco>
            <caracteristicas>
                <tamanho>70 metros quadrados</tamanho>
                <numQuartos>2</numQuartos>
                <numBanheiros>2</numBanheiros>
            </caracteristicas>
        </imovel>
        
        <imovel>
            <descricao>Casa térrea com quintal em bairro tranquilo.</descricao>
            <proprietario>
                <nome>João Almeida</nome>
                <email>joao@gmail.com</email>
                <telefone>(21) 91234-5678</telefone>
            </proprietario>
            <endereco>
                <rua>Rua das Flores</rua>
                <bairro>Jardim</bairro>
                <cidade>Rio de Janeiro</cidade>
                <numero>456</numero>
            </endereco>
            <caracteristicas>
                <tamanho>100 metros quadrados</tamanho>
                <numQuartos>3</numQuartos>
                <numBanheiros>2</numBanheiros>
            </caracteristicas>
        </imovel>
        
        <imovel>
            <descricao>Loft com pé direito alto e vista panorâmica.</descricao>
            <proprietario>
                <nome>Ana Oliveira</nome>
                <email>ana@outlook.com</email>
                <telefone>(19) 98765-4321</telefone>
            </proprietario>
            <endereco>
                <rua>Rua da Liberdade</rua>
                <bairro>Higienópolis</bairro>
                <cidade>São Paulo</cidade>
                <numero>789</numero>
            </endereco>
            <caracteristicas>
                <tamanho>80 metros quadrados</tamanho>
                <numQuartos>1</numQuartos>
                <numBanheiros>1</numBanheiros>
            </caracteristicas>
        </imovel>
        
        <imovel>
            <descricao>Chácara com piscina e área verde.</descricao>
            <proprietario>
                <nome>Pedro Santos</nome>
                <email>pedro@yahoo.com</email>
                <telefone>(31) 91234-5678</telefone>
            </proprietario>
            <endereco>
                <rua>Estrada da Serra</rua>
                <bairro>Rural</bairro>
                <cidade>Belo Horizonte</cidade>
                <numero>1011</numero>
            </endereco>
            <caracteristicas>
                <tamanho>200 metros quadrados</tamanho>
                <numQuartos>4</numQuartos>
                <numBanheiros>3</numBanheiros>
            </caracteristicas>
        </imovel>
        

</imobiliaria>